============================== Prover9 ===============================
Prover9 (32) version Dec-2007, Dec 2007.
Process 13680 was started by popaa on DESKTOP-1LD5VI6,
Wed Nov 24 18:56:37 2021
The command was "/cygdrive/c/Program Files (x86)/Prover9-Mace4/bin-win32/prover9".
============================== end of head ===========================

============================== INPUT =================================
assign(report_stderr,2).
set(ignore_option_dependencies).
if(Prover9).
% Conditional input included.
assign(max_seconds,60).
end_if.
if(Mace4).
% Conditional input omitted.
end_if.

formulas(assumptions).
Joy = 0.
Cassie = 1.
Brian = 2.
Geoff = 3.
Val = 4.
Short(Joy) | Short(Cassie) | Short(Brian) | Short(Geoff) | Short(Val).
Shorter(x,y) & Shorter(y,z) -> Shorter(x,z).
Shorter(x,y) -> -Short(y).
Shorter(Cassie,Joy).
Shorter(Brian,Joy).
Shorter(Cassie,Brian).
Shorter(Geoff,Brian).
Shorter(Geoff,Val).
Shorter(Val,Cassie).
end_of_list.

formulas(goals).
-Short(Val).
end_of_list.

============================== end of input ==========================

% Enabling option dependencies (ignore applies only on input).

============================== PROCESS NON-CLAUSAL FORMULAS ==========

% Formulas that are not ordinary clauses:
1 Shorter(x,y) & Shorter(y,z) -> Shorter(x,z) # label(non_clause).  [assumption].
2 Shorter(x,y) -> -Short(y) # label(non_clause).  [assumption].
3 -Short(Val) # label(non_clause) # label(goal).  [goal].

============================== end of process non-clausal formulas ===

============================== PROCESS INITIAL CLAUSES ===============

% Clauses before input processing:

formulas(usable).
end_of_list.

formulas(sos).
Joy = 0.  [assumption].
Cassie = 1.  [assumption].
Brian = 2.  [assumption].
Geoff = 3.  [assumption].
Val = 4.  [assumption].
Short(Joy) | Short(Cassie) | Short(Brian) | Short(Geoff) | Short(Val).  [assumption].
-Shorter(x,y) | -Shorter(y,z) | Shorter(x,z).  [clausify(1)].
-Shorter(x,y) | -Short(y).  [clausify(2)].
Shorter(Cassie,Joy).  [assumption].
Shorter(Brian,Joy).  [assumption].
Shorter(Cassie,Brian).  [assumption].
Shorter(Geoff,Brian).  [assumption].
Shorter(Geoff,Val).  [assumption].
Shorter(Val,Cassie).  [assumption].
Short(Val).  [deny(3)].
end_of_list.

formulas(demodulators).
end_of_list.

============================== PREDICATE ELIMINATION =================

No predicates eliminated.

============================== end predicate elimination =============

Auto_denials:  (non-Horn, no changes).

Term ordering decisions:
Predicate symbol precedence:  predicate_order([ =, Short, Shorter ]).
Function symbol precedence:  function_order([ Brian, Cassie, Val, Geoff, Joy, 0, 1, 2, 3, 4 ]).
After inverse_order:  (no changes).
Unfolding symbols: (none).

Auto_inference settings:
  % set(paramodulation).  % (positive equality literals)
  % set(binary_resolution).  % (non-Horn)
  % set(neg_ur_resolution).  % (non-Horn, less than 100 clauses)

Auto_process settings:
  % set(factor).  % (non-Horn)
  % set(unit_deletion).  % (non-Horn)

============================== end of process initial clauses ========

============================== CLAUSES FOR SEARCH ====================

% Clauses after input processing:

formulas(usable).
end_of_list.

formulas(sos).
5 0 = Joy.  [copy(4),flip(a)].
7 1 = Cassie.  [copy(6),flip(a)].
9 2 = Brian.  [copy(8),flip(a)].
11 3 = Geoff.  [copy(10),flip(a)].
13 4 = Val.  [copy(12),flip(a)].
15 -Shorter(x,y) | -Shorter(y,z) | Shorter(x,z).  [clausify(1)].
16 -Shorter(x,y) | -Short(y).  [clausify(2)].
17 Shorter(Cassie,Joy).  [assumption].
18 Shorter(Brian,Joy).  [assumption].
19 Shorter(Cassie,Brian).  [assumption].
20 Shorter(Geoff,Brian).  [assumption].
21 Shorter(Geoff,Val).  [assumption].
22 Shorter(Val,Cassie).  [assumption].
23 Short(Val).  [deny(3)].
end_of_list.

formulas(demodulators).
5 0 = Joy.  [copy(4),flip(a)].
7 1 = Cassie.  [copy(6),flip(a)].
9 2 = Brian.  [copy(8),flip(a)].
11 3 = Geoff.  [copy(10),flip(a)].
13 4 = Val.  [copy(12),flip(a)].
end_of_list.

============================== end of clauses for search =============

============================== SEARCH ================================

% Starting search at 0.03 seconds.

given #1 (I,wt=3): 5 0 = Joy.  [copy(4),flip(a)].

given #2 (I,wt=3): 7 1 = Cassie.  [copy(6),flip(a)].

given #3 (I,wt=3): 9 2 = Brian.  [copy(8),flip(a)].

given #4 (I,wt=3): 11 3 = Geoff.  [copy(10),flip(a)].

given #5 (I,wt=3): 13 4 = Val.  [copy(12),flip(a)].

given #6 (I,wt=9): 15 -Shorter(x,y) | -Shorter(y,z) | Shorter(x,z).  [clausify(1)].

given #7 (I,wt=5): 16 -Shorter(x,y) | -Short(y).  [clausify(2)].

given #8 (I,wt=3): 17 Shorter(Cassie,Joy).  [assumption].

given #9 (I,wt=3): 18 Shorter(Brian,Joy).  [assumption].

given #10 (I,wt=3): 19 Shorter(Cassie,Brian).  [assumption].

given #11 (I,wt=3): 20 Shorter(Geoff,Brian).  [assumption].

given #12 (I,wt=3): 21 Shorter(Geoff,Val).  [assumption].

============================== PROOF =================================

% Proof 1 at 0.03 (+ 0.01) seconds.
% Length of proof is 6.
% Level of proof is 2.
% Maximum clause weight is 5.
% Given clauses 12.

2 Shorter(x,y) -> -Short(y) # label(non_clause).  [assumption].
3 -Short(Val) # label(non_clause) # label(goal).  [goal].
16 -Shorter(x,y) | -Short(y).  [clausify(2)].
21 Shorter(Geoff,Val).  [assumption].
23 Short(Val).  [deny(3)].
34 $F.  [resolve(21,a,16,a),unit_del(a,23)].

============================== end of proof ==========================

============================== STATISTICS ============================

Given=12. Generated=38. Kept=25. proofs=1.
Usable=12. Sos=12. Demods=5. Limbo=0, Disabled=16. Hints=0.
Weight_deleted=0. Literals_deleted=0.
Forward_subsumed=12. Back_subsumed=1.
Sos_limit_deleted=0. Sos_displaced=0. Sos_removed=0.
New_demodulators=5 (0 lex), Back_demodulated=0. Back_unit_deleted=0.
Demod_attempts=161. Demod_rewrites=0.
Res_instance_prunes=0. Para_instance_prunes=0. Basic_paramod_prunes=0.
Nonunit_fsub_feature_tests=0. Nonunit_bsub_feature_tests=12.
Megabytes=0.03.
User_CPU=0.03, System_CPU=0.01, Wall_clock=0.

============================== end of statistics =====================

============================== end of search =========================

THEOREM PROVED

Exiting with 1 proof.

Process 13680 exit (max_proofs) Wed Nov 24 18:56:37 2021
